{
  "id": "b07-r01",
  "batch": 7,
  "title": "וויניגרט לסלט",
  "source": null,
  "medium": "handwritten",
  "ingredients": [
    {
      "group": null,
      "items": [
        "5 כפות שמן זית",
        "3 כפות מיץ לימון טרי",
        "1.5 כף דבש",
        "1.5 כף חרדל דיזון",
        "1 שן שום כתוש",
        "כפית מלח",
        "מעט פילפל שחור"
      ]
    }
  ],
  "instructions": [],
  "notes": [
    "Ingredient list only, no method. Underlined title at the top.",
    "Spelling kept as written (פילפל, דיזון). Quantities 1.5 written with a decimal point on both lines; the unit for mustard is כף (not כפית) as written."
  ],
  "incidental_text": [],
  "raw_files": [
    {
      "file": "raw/Scanned_20261004-2144-01.jpg",
      "original_path": "Batch 7/Scanned_20261004-2144-01.jpg",
      "rotation_applied_cw_degrees": 0,
      "side": "single"
    }
  ],
  "needs_human_verification": true,
  "confidence": "medium",
  "uncertainties": [
    {
      "field": "title",
      "text": "וויניגרט לסלט",
      "best_guess": "Gemini: ויניגרט (single ו)",
      "reason": "The opening strokes could be 'וו' or 'ו'+'י'; spelling of the first word is not fully clear (meaning is unaffected)."
    }
  ],
  "transcription": {
    "method": "ai_reread_with_gemini_second_opinion",
    "date": "2026-10-05",
    "human_verified": false,
    "verified_by": null,
    "verified_at": null
  }
}