{
  "id": "b05-r11",
  "batch": 5,
  "title": "קציצות עוף עסיסיות ברוטב דלעת",
  "source": null,
  "medium": "clipping",
  "ingredients": [
    {
      "group": "לקציצות (4 מנות)",
      "items": [
        "300 גרם חזה עוף טחון",
        "300 גרם סטייק פרגית טחון",
        "2 בצלים גדולים, קלופים ומגוררים",
        "2 ביצים",
        "1/2 כוס פטרוזיליה, קצוצה",
        "10 כפות שיבולת שועל מהירת הכנה (קוואקר), דקה",
        "מלח, פלפל שחור",
        "לטיגון: שמן זית"
      ]
    },
    {
      "group": "לרוטב",
      "items": [
        "שמן זית",
        "2 בצלים גדולים, קלופים ופרוסים",
        "1 ק\"ג דלעת, פרוסה דק",
        "מלח, פלפל שחור",
        "תיבול לבחירה – קינמון ושאטה/ זעפרן וכורכום/ פפריקה וכמון",
        "מים"
      ]
    }
  ],
  "instructions": [
    {
      "group": "ההכנה",
      "steps": [
        "הרוטב: מחממים בסיר שכבה דקה של שמן זית, מוסיפים את הבצל הפרוס ומאדים אותו על להבה בינונית עד שהוא שקוף. מוסיפים את פרוסות הדלעת, מגבירים את עוצמת הלהבה וחורכים קלות את הדלעת, כך שייראו בה סימני צריבה. מוסיפים את התבלינים הנבחרים, מערבבים כחצי דקה ומוסיפים מים עד לכיסוי הירקות. מביאים לרתיחה, מכסים ומבשלים על להבה נמוכה כ־20 דקות, עד שהדלעת מתפוררת ונוצר רוטב.",
        "בינתיים, מכינים את הקציצות: שמים בקערה את כל מרכיביהן ומערבבים לעיסה רטובה במקצת.",
        "מחממים מעט שמן זית במחבת. יוצרים קציצות קטנות מהעיסה ומטגנים עד הזהבה משני הצדדים.",
        "מוסיפים את הקציצות לסיר הרוטב ומבשלים יחד כ־10 דקות. מסירים מהכיריים ומגישים חם."
      ]
    }
  ],
  "notes": [
    "איך שומרים? במקרר, 3 ימים.",
    "Intro text: 'קציצות הן תמיד תענוג, ובייחוד הקציצות האלו. הן פשוטות וטעימות עד מאוד, קל לחטוף אחת־שתיים קרות מהמקרר וכיף לחמם אותן ולאכול עם אורז.'",
    "The second word of the title (partly hidden by a shadow) reads 'עסיסיות'."
  ],
  "incidental_text": [],
  "raw_files": [
    {
      "file": "raw/Scanned_20261004-2117-10.jpg",
      "original_path": "Batch 5/Scanned_20261004-2117-10.jpg",
      "rotation_applied_cw_degrees": 0,
      "side": "single"
    }
  ],
  "needs_human_verification": false,
  "confidence": "high",
  "uncertainties": [
    {
      "field": "source",
      "text": "none",
      "best_guess": null,
      "reason": "Publication not visible on the clipping."
    }
  ],
  "transcription": {
    "method": "ai_read_from_scan",
    "date": "2026-10-05",
    "human_verified": false,
    "verified_by": null,
    "verified_at": null
  }
}
