{
  "id": "b07-r14",
  "batch": 7,
  "title": "סלט כרוב",
  "source": {
    "text": "[?]",
    "type": "unknown",
    "as_written": "[?]",
    "uncertain": true
  },
  "medium": "handwritten",
  "ingredients": [
    {
      "group": null,
      "items": [
        "1 חבילת [?] [?]",
        "1 כוסית שמן",
        "1/4 כוסית רוטב סויה",
        "1 כף סוכר",
        "1/2 כפית מלח"
      ]
    },
    {
      "group": "below the ruled line",
      "items": [
        "קשיו, צנוברים, פקן"
      ]
    }
  ],
  "instructions": [],
  "notes": [
    "Title line reads 'סלט כרוב / [name]'. A handwritten name (or signature) appears at the lower left, probably the source; the first ingredient (a package) is not clear."
  ],
  "incidental_text": [],
  "raw_files": [
    {
      "file": "raw/Scanned_20261004-2144-15.jpg",
      "original_path": "Batch 7/Scanned_20261004-2144-15.jpg",
      "rotation_applied_cw_degrees": 0,
      "side": "single"
    }
  ],
  "needs_human_verification": true,
  "confidence": "medium",
  "uncertainties": [
    {
      "field": "title",
      "text": "סלט כרוב",
      "best_guess": "סלט כרוב",
      "reason": "Second word of the title read as 'כרוב'."
    },
    {
      "field": "source",
      "text": "name after the slash / at the lower left",
      "best_guess": null,
      "reason": "Unclear; looks like a first name."
    },
    {
      "field": "ingredients[0]",
      "text": "1 חבילת [?] [?]",
      "best_guess": null,
      "reason": "Package contents unreadable."
    },
    {
      "field": "ingredients[2]",
      "text": "1/4 כוסית רוטב סויה",
      "best_guess": "רוטב סויה",
      "reason": "'רוטב סויה' (soy sauce) is the most likely reading."
    }
  ],
  "transcription": {
    "method": "ai_read_from_scan",
    "date": "2026-10-05",
    "human_verified": false,
    "verified_by": null,
    "verified_at": null
  }
}
