{
  "id": "b20-r09",
  "batch": 20,
  "title": null,
  "source": null,
  "medium": "handwritten",
  "ingredients": [
    {
      "group": null,
      "items": [
        "7 כפיות סוכר חום",
        "1 1/2 כפיות מלח",
        "2 שיני שום כתושות"
      ]
    }
  ],
  "instructions": [],
  "notes": [
    "Handwriting is only partly legible; unreadable words are [?]. Three short lines at the top of an otherwise blank card. The first line reads '... פחיות סלק חום' (cans of beetroot), the second '... כפיות מלח', the third starts with '2' and ends with a word that could be 'בתנועות'. Numbers are shaky (the first digit could be 4 or 7).",
    "Same card size and similar hole mark as the previous scan in this batch (10); no connection is claimed."
  ],
  "incidental_text": [],
  "raw_files": [
    {
      "file": "raw/Scanned_20261004-2248-11.jpg",
      "original_path": "Batch 20/Scanned_20261004-2248-11.jpg",
      "rotation_applied_cw_degrees": 0,
      "side": "single"
    }
  ],
  "needs_human_verification": true,
  "confidence": "low",
  "uncertainties": [
    {
      "field": "title",
      "text": "[?]",
      "best_guess": null,
      "reason": "No heading visible; ingredient-only note."
    }
  ],
  "transcription": {
    "method": "ai_reread_codex_crops_crosschecked_claude",
    "date": "2026-10-05",
    "human_verified": false,
    "verified_by": null,
    "verified_at": null
  }
}
