{
  "id": "b15-r02",
  "batch": 15,
  "title": "חביתות בשכבות",
  "source": null,
  "medium": "handwritten",
  "ingredients": [],
  "instructions": [
    {
      "group": null,
      "steps": [
        "8 חביתות:",
        "על חביתה מס' 1 למרוח מיונז",
        "לשים עלה חסה, חתיכות עגבניה ומלפפון",
        "מס' 2: 1 ביצה קשה פרוסות [?] או זיתים",
        "מס' 3: [?] [?] [?] פרוסות גמבה או פלפל אדום [?]",
        "מס' 4: [?] טונה",
        "[?] ועוד 4 חביתות",
        "[?] על מגש [?] [?] [?]",
        "גבינה מלוחה או צהובה"
      ]
    }
  ],
  "notes": [
    "Handwriting is only partly legible; unreadable words are [?]. Layered omelet ('חביתות בשכבות'): four omelets, each with a different filling (as read). This is an interpretation of the card, not a statement on it. There are no ingredient quantities.",
    "First line says eight omelets, later repeat another four; final cheese option is צהובה, not בולגרית."
  ],
  "incidental_text": [],
  "raw_files": [
    {
      "file": "raw/Scanned_20261004-2217-02.jpg",
      "original_path": "Batch 15/Scanned_20261004-2217-02.jpg",
      "rotation_applied_cw_degrees": 0,
      "side": "single"
    }
  ],
  "needs_human_verification": true,
  "confidence": "low",
  "uncertainties": [
    {
      "field": "instructions[3..7]",
      "text": "several lines",
      "best_guess": null,
      "reason": "Several words in the lines for omelets 2-4 and the last lines are unreadable."
    }
  ],
  "transcription": {
    "method": "ai_reread_codex_crops_crosschecked_claude",
    "date": "2026-10-05",
    "human_verified": false,
    "verified_by": null,
    "verified_at": null
  }
}
