{
  "id": "b07-r08",
  "batch": 7,
  "title": "סלט תערובת ירקות",
  "source": {
    "text": "חיה",
    "type": "person",
    "as_written": "חיה",
    "uncertain": false
  },
  "medium": "handwritten",
  "ingredients": [],
  "instructions": [
    {
      "group": null,
      "steps": [
        "[?] [?] [?]",
        "[?] [?], חמוציות וגזר",
        "[?] [?]",
        "[?] [?] [?] [?]",
        "[?] [?] [?] [?] ובכוסות",
        "[?] [?] 1 [?] [?] [?] בצל",
        "[?] [?] [?] ירוק [?] [?]ים",
        "רוטב: [?] [?]ות ריבת משמש"
      ]
    }
  ],
  "notes": [
    "Square-ish card with a construction-company letterhead; a name (probably the source) is written in blue at the upper left. A list of salad ingredients, last line 'רוטב:' (dressing) with 'ריבת משמש' (apricot jam). Most of the list remains unreadable.",
    "The file 'gemini_transcribtion.txt' describes a different recipe (apple salad with mayonnaise) and was disregarded; 'gemini_transcribtion (1).txt' matches this card."
  ],
  "incidental_text": [
    "Printed letterhead of a contracting company group"
  ],
  "raw_files": [
    {
      "file": "raw/Scanned_20261004-2144-09.jpg",
      "original_path": "Batch 7/Scanned_20261004-2144-09.jpg",
      "rotation_applied_cw_degrees": 0,
      "side": "single"
    }
  ],
  "needs_human_verification": true,
  "confidence": "low",
  "uncertainties": [
    {
      "field": "instructions",
      "text": "lines 1-7 (ingredient list)",
      "best_guess": "Gemini's list (order and line breaks not confirmed): חסות שונות בויניגרט; פטריות טריות; חמוציות; גזר; אגוזים; עגבניות שרי; אפרסמון; משמשים מיובשים; שקדים; דובדבנים יבשים; קולרבי; סלק חי מגורר. Our earlier reading also saw '1 ... בצל' and 'ירוק', which Gemini does not list.",
      "reason": "Most words unreadable; Gemini's list is only partly consistent with the ink."
    },
    {
      "field": "instructions",
      "text": "last line: word(s) between 'רוטב:' and 'ריבת'",
      "best_guess": null,
      "reason": "Overwritten/scribbled word and a word ending in 'ות'. Gemini wrote 'ריבת תאנים [mixed with vinegar, oil, spices]', but the card clearly reads 'משמש' (apricot), and the rest is not on the card."
    }
  ],
  "transcription": {
    "method": "ai_reread_codex_crops_crosschecked_claude",
    "date": "2026-10-05",
    "human_verified": false,
    "verified_by": null,
    "verified_at": null
  }
}
